{
  "schema_version": 1,
  "template_version": "kub01-v2",
  "namespace": "swarm-pod-proof",
  "service_account": "swarm-worker",
  "runtime_class_name": "kata-fc",
  "image_repository": "ghcr.io/the-cloud-clockwork/agentihooks-worker",
  "brain_url": "http://brain-api.swarm-brain.svc:8080",
  "termination_grace_seconds": 60,
  "provider_accounts": [
    "claude-fixture@example.com",
    "codex-fixture@example.com"
  ],
  "profiles": {
    "general": {
      "limits": {
        "memory_mib": 4096,
        "cpu_millis": 2000,
        "ephemeral_mib": 10240
      },
      "node_selector": {
        "anton.io/pool": "general"
      },
      "tolerations": [
        {
          "key": "anton.io/spot",
          "operator": "Exists",
          "effect": "NoSchedule"
        }
      ],
      "excluded_nodes": {
        "anton.io/pool": [
          "research"
        ]
      }
    }
  },
  "probes": {
    "herdr_timeout_seconds": 2,
    "brain_timeout_seconds": 2,
    "startup": {
      "initial_delay_seconds": 0,
      "period_seconds": 5,
      "timeout_seconds": 6,
      "failure_threshold": 24
    },
    "readiness": {
      "initial_delay_seconds": 0,
      "period_seconds": 10,
      "timeout_seconds": 6,
      "failure_threshold": 3
    },
    "liveness": {
      "initial_delay_seconds": 0,
      "period_seconds": 15,
      "timeout_seconds": 6,
      "failure_threshold": 4
    }
  },
  "mounts": [
    {
      "name": "profiles",
      "purpose": "seed",
      "mount_path": "/opt/swarm-seed",
      "source": {
        "claim": "swarm-seed"
      }
    },
    {
      "name": "artifacts",
      "purpose": "artifact",
      "mount_path": "/home/worker/artifacts",
      "source": {
        "nfs": {
          "server": "nas.anton.lan",
          "path": "/export/swarm-artifacts"
        }
      }
    },
    {
      "name": "node-cache",
      "purpose": "cache",
      "mount_path": "/home/worker/cache",
      "source": {
        "host_path": "/var/lib/swarm-cache"
      }
    }
  ]
}
